{
  "candidate_pin_order": [
    "VDD",
    "VSS",
    "VREF",
    "ENB",
    "VOUT"
  ],
  "candidate_subckt": "evoldo_sky130_ldo",
  "hard_rules": [
    "no independent or controlled ideal source inside DUT",
    "no .ic or .nodeset",
    "all declared measurements must be present",
    "fresh simulation evidence must match candidate digest"
  ],
  "injected_fault": "The pass device is intentionally under-sized.",
  "objective": "Repair and size the transistor-level LDO so it regulates at 1 mA without excessive supply current.",
  "pdk": "sky130",
  "scenarios": [
    {
      "bench_template": "../../benches/operating_point.sp.tpl",
      "corner": "tt",
      "limits": {
        "quiescent_current": {
          "max": 5e-05,
          "min": 0.0
        },
        "supply_current": {
          "max": 0.00105,
          "min": 0.001
        },
        "vfb_final": {
          "max": 1.02,
          "min": 0.96
        },
        "vout_final": {
          "max": 1.53,
          "min": 1.44
        }
      },
      "scenario_id": "tt_nominal",
      "temperature_c": 27
    }
  ],
  "schema_version": "1.0",
  "simulator": "ngspice",
  "starter_candidate": "starter/ldo.sp",
  "task_id": "sky130_ldo_operating_point",
  "title": "Close nominal operating point and quiescent current"
}
